{
  "schema": "foursday-historical-project-import/v1",
  "project": {
    "projectId": "example_project",
    "name": "Example project",
    "rootDirectory": "/absolute/path/to/project",
    "requesterIds": ["verified-owner-id"],
    "profile": {
      "objective": "Reuse verified decisions from the historical project",
      "successCriteria": ["Every imported fact remains traceable to a source file"],
      "milestones": ["Review the first historical memory candidates"],
      "collaborationObjects": ["repository"],
      "selectedRecipeIds": ["project-follow-up"],
      "memoryScope": {
        "allowedTypes": ["project", "principle"],
        "retentionDays": 180
      }
    }
  },
  "sources": [
    {
      "id": "project_history",
      "path": "docs/project-history.md"
    }
  ],
  "memories": [
    {
      "type": "project",
      "statement": "Release decisions require target-system read-back.",
      "factKey": "delivery.readback_rule",
      "sourceId": "project_history",
      "sourceQuote": "Release decisions require target-system read-back.",
      "sensitivity": "internal",
      "confidence": 1,
      "retentionDays": 180
    }
  ]
}
